### ISSUE TITLE
TLS handshake error from EOF

### ISSUE THREAD

**Issue by galyfray** [bernardo-bruning/ollama-copilot#33]
I installed the project folowing the instruction, but it does not work and this error keeps apearing int the log : 

```
2025/05/29 14:50:31 http: TLS handshake error from [::1]:41468: EOF
2025/05/29 14:50:31 request: POST /v1/engines/gpt-4o-copilot/completions
2025/05/29 14:50:31 response: POST /v1/engines/gpt-4o-copilot/completions 404 34.375µs
```

Using tcpcump I was able to gather this : 

```
14:50:31.572372 IP6 localhost.41468 > localhost.11436: Flags [S], seq 2455997614, win 65476, options [mss 65476,sackOK,TS val 2005831875 ecr 0,nop,wscale 7], length 0
14:50:31.572383 IP6 localhost.11436 > localhost.41468: Flags [S.], seq 4107551839, ack 2455997615, win 65464, options [mss 65476,sackOK,TS val 2005831875 ecr 2005831875,nop,wscale 7], length 0
14:50:31.572391 IP6 localhost.41468 > localhost.11436: Flags [.], ack 1, win 512, options [nop,nop,TS val 2005831875 ecr 2005831875], length 0
14:50:31.573046 IP6 localhost.41468 > localhost.11436: Flags [P.], seq 1:392, ack 1, win 512, options [nop,nop,TS val 2005831876 ecr 2005831875], length 391
14:50:31.573054 IP6 localhost.11436 > localhost.41468: Flags [.], ack 392, win 509, options [nop,nop,TS val 2005831876 ecr 2005831876], length 0
14:50:31.575487 IP6 localhost.11436 > localhost.41468: Flags [P.], seq 1:1428, ack 392, win 512, options [nop,nop,TS val 2005831878 ecr 2005831876], length 1427
14:50:31.575500 IP6 localhost.41468 > localhost.11436: Flags [.], ack 1428, win 601, options [nop,nop,TS val 2005831878 ecr 2005831878], length 0
14:50:31.576267 IP6 localhost.41468 > localhost.11436: Flags [F.], seq 392, ack 1428, win 601, options [nop,nop,TS val 2005831879 ecr 2005831878], length 0
14:50:31.576302 IP6 localhost.11436 > localhost.41468: Flags [F.], seq 1428, ack 393, win 512, options [nop,nop,TS val 2005831879 ecr 2005831879], length 0
```

This leads me to think the problem comes from the proxy not expecting the server to answer with https.

**Comment by galyfray** [comment]
I managed to get it workign by running it from sources, I think the project needs a new release ...

**Comment by galyfray** [comment]
So, just saw that a new debug argument got added, took the time to check how the new version behave.
first of : it does work, I have completion proposals but I still have the TLS logs :
```
2026/02/19 21:44:37 request: POST /v1/engines/gpt-4o-copilot/completions [::1]:39300
2026/02/19 21:44:37 response: POST /v1/engines/gpt-4o-copilot/completions 200 356.118567ms
2026/02/19 21:44:37 accepted connection from 192.168.1.122:47304 to 192.168.1.122:11435
2026/02/19 21:44:37 http: TLS handshake error from [::1]:57588: EOF
2026/02/19 21:44:37 request: POST /telemetry [::1]:45202
2026/02/19 21:44:37 response: POST /telemetry 404 45.977µs
2026/02/19 21:44:38 accepted connection from 192.168.1.122:47312 to 192.168.1.122:11435
2026/02/19 21:44:38 http: TLS handshake error from [::1]:57600: EOF
2026/02/19 21:44:38 request: POST /v1/engines/gpt-4o-copilot/completions [::1]:39300
2026/02/19 21:44:38 response: POST /v1/engines/gpt-4o-copilot/completions 200 90.86266ms
2026/02/19 21:44:38 accepted connection from 192.168.1.122:47316 to 192.168.1.122:11435
2026/02/19 21:44:38 http: TLS handshake error from [::1]:57616: EOF
2026/02/19 21:44:38 request: POST /v1/engines/gpt-4o-copilot/completions [::1]:39300
2026/02/19 21:44:39 response: POST /v1/engines/gpt-4o-copilot/completions 200 435.389722ms
2026/02/19 21:44:39 accepted connection from 192.168.1.122:47322 to 192.168.1.122:11435
2026/02/19 21:44:39 http: TLS handshake error from [::1]:57628: EOF
2026/02/19 21:44:39 request: POST /v1/engines/gpt-4o-copilot/completions [::1]:39300
2026/02/19 21:44:39 response: POST /v1/engines/gpt-4o-copilot/completions 200 594.194291ms
2026/02/19 21:44:40 accepted connection from 192.168.1.122:47334 to 192.168.1.122:11435
2026/02/19 21:44:40 accepted connection from 192.168.1.122:47336 to 192.168.1.122:11435
2026/02/19 21:44:40 http: TLS handshake error from [::1]:57634: EOF
2026/02/19 21:44:40 request: POST /v1/engines/gpt-4o-copilot/completions [::1]:39300
2026/02/19 21:44:40 response: POST /v1/engines/gpt-4o-copilot/completions 200 341.123111ms
2026/02/19 21:44:41 accepted connection from 192.168.1.122:47348 to 192.168.1.122:11435
2026/02/19 21:44:41 accepted connection from 192.168.1.122:47360 to 192.168.1.122:11435
2026/02/19 21:44:41 http: TLS handshake error from [::1]:57646: EOF
2026/02/19 21:44:41 request: POST /v1/engines/gpt-4o-copilot/completions [::1]:39300
2026/02/19 21:44:41 response: POST /v1/engines/gpt-4o-copilot/completions 200 63.091549ms
2026/02/19 21:44:47 accepted connection from 192.168.1.122:47140 to 192.168.1.122:11435
2026/02/19 21:44:47 http: TLS handshake error from [::1]:36556: EOF
2026/02/19 21:44:47 request: POST /telemetry [::1]:45202
2026/02/19 21:44:47 response: POST /telemetry 404 37.922µs
2026/02/19 21:45:02 accepted connection from 192.168.1.122:33308 to 192.168.1.122:11435
2026/02/19 21:45:02 http: TLS handshake error from [::1]:55186: EOF
```

**Comment by bernardo-bruning** [comment]
Yes, I imagine. This is a problem I'm continuing to investigate, but since I'm short on time, it may take a while to resolve these error messages.

Thank you for taking the time to test; I'm glad that at least the system is basically performing its function.
